{
  "schema_version": "1.0",
  "classification": "SYNTHETIC_NOT_EVIDENCE",
  "release_id": "orion-release-b",
  "manufacturer": "Orion Synthetic Devices",
  "product": "Orion Edge Controller",
  "product_version": "7.4.1-synthetic",
  "build_id": "orion-build-b",
  "architecture": "arm64-synthetic",
  "hardware_revision": "orion-hw-r1",
  "artifact_relative_path": "artifacts/orion-bundle.tar",
  "artifact_sha256": "097fc4ded3f24ce2ac5ab1f665285b907d646452c166123347661a36bd2e4e8b",
  "inputs": {
    "build_manifest": {
      "relative_path": "evidence/build-manifest.json",
      "sha256": "4bfa9941ff7c4a63f6141d2483da98370e8e83e69a027711cb3ffedafae73d00"
    },
    "artifact_inventory": {
      "relative_path": "evidence/artifact-inventory.json",
      "sha256": "a2dcf74779c102454f8d931ecbe6545c12ed05948c82e46e11f0f0646f906f1f"
    }
  },
  "release_timestamp": "2026-08-02T02:00:00Z",
  "sbom_author": "Orion Synthetic Fixture Builder",
  "sbom_version": "2",
  "evidence_cutoff": "2026-08-02T01:59:00Z"
}
